<?xml version="1.0" encoding="UTF-8"?>
<xs:schema xmlns:xs="http://www.w3.org/2001/XMLSchema" elementFormDefault="qualified">
  <xs:element name="alumnos">
    <xs:complexType>
      <xs:sequence>
        <xs:element ref="alumno" maxOccurs="unbounded"/>
      </xs:sequence>
    </xs:complexType>
  </xs:element>
  <xs:element name="alumno">
    <xs:complexType>
      <xs:sequence>
        <xs:element name="nombre" type="xs:string"/>
        <xs:element name="dni" type="xs:string"/>
        <xs:element ref="direccion"/>
        <xs:element ref="telefono"/>
      </xs:sequence>
    </xs:complexType>
  </xs:element>
  <xs:element name="direccion">
    <xs:complexType>
      <xs:sequence>
        <xs:element name="calle" type="xs:string"/>
        <xs:element name="numero" type="xs:string"/>
        <xs:element name="ciudad" type="xs:string"/>
        <xs:element name="provincia" type="xs:string"/>
      </xs:sequence>
    </xs:complexType>
  </xs:element>
  <xs:element name="telefono">
    <xs:complexType>
      <xs:sequence minOccurs="0">
        <xs:element name="telefono_fijo" type="xs:string"/>
        <xs:element name="telefono_movil" type="xs:string"/>
      </xs:sequence>
    </xs:complexType>
  </xs:element>
</xs:schema>
